Title,Company,Location,JobDescription
Head of FInance Unit/ Finance Analyst,UNDP Armenia,"Yerevan, Armenia","Under the guidance and direct supervision of the DRR
and Operations Manager, the Head of Finance Unit is responsible for
effective delivery of financial services, transparent utilization of
financial resources, ensuring financial services integrity. He/she
analyzes and interprets the financial rules and regulations and provides
solutions to a wide spectrum of complex financial issues. The Head of
Finance Unit promotes a client-oriented approach consistent with UNDP
rules and regulations.
The Head of Finance Unit supervises and leads the support staff of the
Finance Unit. The Head of Finance Unit works in close collaboration with
the operations, programme and project teams in the CO and UNDP HQs staff
ensuring successful CO performance in Finance."
Finance Assistant,UNDP Armenia,"Yerevan, Armenia","Under the guidance and supervision of the UNDP Head of
Finance Unit, the Finance Assistant is responsible for providing
financial services to all common shared activities of the UN Country
Team in Armenia, ensuring high quality, accuracy and consistency of
work.
The Finance Assistant promotes a client-oriented and consistent with
rules and regulations approach. The Finance Assistant works in close
collaboration with the UNDP Operations Unit, UN Building Manager, UN
Agency Administrative Officers and UNDP HQs staff to exchange
information and ensure consistent service delivery."
Finance Associate,UNDP Armenia,"Yerevan, Armenia","Under the guidance and supervision of the Head of
Finance Unit, Finance Associate ensures effective execution of financial
services and processes in CO and transparent utilization of financial
resources. The Finance Associate promotes a client-oriented and
consistent with rules and regulations approach in the Unit.
The Finance Associate works in close collaboration with the operations,
programme and projects' staff in the CO and UNDP HQs staff for resolving
complex finance-related issues and information exchange."
Promotion Specialist,ARISION Armenian-French Public Magazin,"Yerevan, Armenia",N/A
Software Engineers,MargaSoft,"Yerevan, Armenia","Basically we are looking for smart, organized and
responsible developers.
This position offers an opportunity for the dedicated individuals with
limited amount of experience.
For the experienced professionals leadership position is available when
responsibility makes perfect sense with the power of execution."
Web Master,Armenian Foreign Minstry,"Yerevan, Armenia","Armenian Ministry of Foreign Affairs is seeking a Web
Master to join the MFA Web Designers' team."
Computer Specialist-Designer,ARISION Armenian-French Pubic Journal,"Yerevan, Armenia",N/A
Senior Web Developer,Armenian Foreign Ministry,"Yerevan, Armenia","Armenian Foreign Ministry is seeking for a Senior Web
Developer to join the MFA Web Designers' team."
Web Designer,Armenian Foreign Ministry,"Yerevan, Armenia","Armenian Ministry of Foreign Affairs is seeking for a
Web Designer to join the MFA Web Designers' team."
Area Sales Manager,Yerevan Brandy Company,"Yerevan, Armenia","Yerevan Brandy Company seeks qualified candidate to
fill the position of Area Sales Manager to work in the Export
Department."
English Language Courses,Career Center NGO,"Yerevan, Armenia
DETAIL DESCRIPTION:  Career Center announces the start of below
mentioned English Language Courses:
- The Main English Course (consisting a total of 3 levels)
1. Beginner
2. Intermediate
3. Advanced
The duration of each level is 3 months.
SPECIAL COURSES:
- Business English - Part I (Basic, Non certificate)
- Business English - Part II (Complete) 
- Business Writing 
- Business Communication 
- TOEFL Preparation (Non certificate)
The duration of each course(part) is 2 months.",NA
PHP Programmer,3A&M Logic,"Yerevan, Armenia",N/A
Flasher,3A&M Logic,"Yerevan, Armenia","The Flasher shall work with web sites, create flash
intros."
Receptionist,Europe Hotel,"Yerevan, Armenia","- Receive, greet and register guests on arrival;
- Attend to the guests' Front Desk needs;
- Handle telephone calls;
- Maintain guest ledger, post charges;
- Check out the guests."
Assistant to Accountant/ Economist,Clear Water,"Yerevan, Armenia",N/A
Assistant to Accountant/ Economist,Clear Water,"Yerevan, Armenia",N/A
Secretary,"""ArmenCell"" CJSC","Yerevan, Armenia","We are looking for a Secretary to work as a team
member in providing comprehensive administrative and clerical suport,
provide a consistent, effective and confidential personnel
administrative service for the managers and the staff, organize and
support efficient administration."
Administrative Assistant,ArmenCell CJSC,"Yerevan, Armenia",N/A
On-line Consultations on Import and Export Related Customs,"Center for Regional Development/ Transparency International Armenia
(CRD/TI Armenia)","Armenia & Georgia
DETAIL DESCRIPTION:  Starting from 01 March till 15 July 2005, Center
for Regional Development/Transparency International Armenia, along with
its regional partners, is providing free on-line consultations on import
and export related customs procedures in Armenia and Georgia within the
project entitled ""Trade Facilitation in the South Caucasus"" and funded
by the South Caucasus Cooperation Program of the Eurasia Foundation and
OSCE Office in Yerevan.
All interested entrepreneurs and companies can visit www.transparency.am
""online consultations"" directory or call: (3741) 585578 on Mondays,
Wednesdays and Fridays from 4 pm to 6 pm.",NA
Analyst,Central Bank of Armenia,"Yerevan, Armenia","We are looking for an Analyst for the Financial
Intelligence Unit under the board of Central Bank of Armenia (herein
FIU)."
Methodologist,Central Bank of Armenia,"Yerevan, Armenia","We are looking for a Methodologist for the Financial
Intelligence Unit under the board of Central Bank of Armenia (herein
FIU)."
Database Manager,Central Bank of Armenia,"Yerevan, Armenia","We are looking for a Database Manager for the
Financial Intelligence Unit under the board of Central Bank of Armenia
(herein FIU)."
Responsible for International Relations and Trainings,Central Bank of Armenia,"Yerevan, Armenia","We are looking for a person to be Responsible for
International Relations and Trainings for the Financial Intelligence
Unit under the board of Central Bank of Armenia (herein FIU)."
Pharmacist,Mdecins Sans Frontires-Belgium,"Vardenis, Gegharkunik Marzes, Armenia","The Pharmacist will be responsible for MSF pharmacy
stock, ensure provision of drugs for the rural health ambulatories and
policlinics included in the project."
Assistant to Social Work Supervisor,Mdecins Sans Frontires-Belgium,"Sevan - Gegharkunik Marz, Armenia","Under the direct supervision of the MSF Expatriate
Social Worker, the Assistant to Social Work Supervisor will participate
in the set-up of the social work activities in the Day Centres and MHC,
assist in the coordination of social work, in the supervision of the
social workers of the project, ensure training and meetings, liaise with
states services and other organizations."
Portfolio Coordinator on Socio-Economic Governance,UNDP Armenia Country Office,"Yerevan, Armenia","Under the guidance and direct supervision of the
Deputy Resident Representative, the Portfolio Coordinator is responsible
for the general coordination of UNDPs socio-economic governance
programme. The Portfolio Coordinator is responsible for supervising
portfolio support staff and coordinating the activities of specialist
personnel. The Portfolio Coordinator works in close collaboration with
the National Portfolio Director, Government officials, UNDPs operations
team, programme staff in other UN Agencies, UNDP HQs staff, technical
advisors and experts, multi-lateral and bi-lateral donors and civil
society."
Front Desk Clerk/ Administrator,Tufenkian Hospitality,"Dzoraget, Lori province, Armenia","We are looking for a person to work as Front Desk
Clerk/ Administrator at Tufenkian Dzoraget Hotel in Lori Province."
Salesman,Tufenkian Hospitality,"Tsapatagh, Gegharkounik region, Armenia","To work as Showroom Salesman at Avan Marak Tsapatagh
Complex."
Engineer,"""SolarEn"" LLC","Yerevan, Armenia","SolarEn, LLC is seeking a candidate for the position
of Engineer who has technical knowledge and experience of working in
HVAC, gas and/or power engineering areas."
Software Engineer,CIT Ltd,"Yerevan, Armenia","CIT Ltd. is currently seeking qualified candidates for
the position of Software Engineer to work on projects. The incumbent will
work under the guidance of Head of the Department of Programming of
Automated Administration and Internet Systems and will report directly
to him."
National Expert,UNDP Armenia Country Office,"Yerevan, Armenia","Under the overall supervision of the National Project
Director and Portfolio Manager, and the direct supervision of the
Project Coordinator, the National Expert will assist in raising public
awareness on human rights through a Public Awareness Campaign to be
designed and implemented within the framework of the Project."
IT Supplier/ Sales Assistant,CIT Ltd,"Yerevan, Armenia",N/A
Tour Guide,Tufenkian Hospitality,"Yerevan, Armenia","We are looking for English speaking qualified Tour
Guides to conduct tours all over Armenia as applicable."
Dispatcher,UNDP Armenia Country Office,"Yerevan, Armenia","Under the guidance and direct supervision of the
Administrative Associate, the Dispatcher is responsible for managing
UNDPs motor pool in an efficient and cost-effective manner. The
Dispatcher is responsible for ensuring that UNDP drivers work at the
highest professional protocol and security standards. The Dispatcher
promotes client-oriented driving services and ensures that the motor
pool operates on the basis of UNDP rules and regulations."
Administrative Services Manager,Center for Agribusiness & Rural Development (CARD),"Yerevan, Armenia","Under the direct supervision of the CARD Director/
Deputy Director, the incumbent acts as a manager and an adviser on all
administrative and general support operations of CARD, converting
operational strategies into coordinated sets of unit plans with actions
and deliverables. This includes forward looking human resources
management, accurate financial management of administrative and general
support services, highly responsive operational and logistical
activities including procurement, transportation, events organizing and
management"
Finance Manager,Center for Agribusiness & Rural Development (CARD),"Yerevan, Armenia","Under the direct supervision of the CARD Director/
CARD Deputy Director, the incumbent acts as the manager and chief
accountant for all financial operations of CARD, converting
organizational strategies and policies into financial support systems,
instruments and reports. This includes accurate financial management of
all accounts for both CARD and its programs/projects, with a strong
commitment to transparency, effectiveness and optimal efficiency."
Water and Wastewater Specialist,Chemoincs International,"Yerevan, Armenia","We are looking for a Water Engineer with experience
assessing needs of water and wastewater infrastructure."
Lessons Learned from Peacebuilding in Conflict Zones,Caucasus Research Resourse Centers-Armenia,"Yerevan, Armenia
DETAIL DESCRIPTION:  On March 7, 2005 at 17:00, together with the
Consortium Initiative, CRRC-Armenia is pleased to introduce a public
lecture on ""Lessons learned from peacebuilding in conflict zones"".
The lecture that intends to touch peacebuilding and conflict
transformation process using specific examples from various conflicts
around the world, is delivered by honorable Mr. Smith Dan, Secretary
General, International Alert.
The lecture will take place at the American University of Armenia (AUA)
small auditorium, address: 40 Marshal Baghramyan Ave., 5th floor.",NA
Communications and Development Coordinator,"Caucasus Research Resource Centers, a Program of the Eurasia Foundation","Yerevan, Armenia","Under the supervision of the CRRC Program Director,
the CRRC Development and Communications Coordinator is responsible for
coordinating communications and outreach for a growing network of social
science resource and training centers. Further detail on the CRRC program
can be found at: www.crrccenters.org."
Office Assistant,Consulate of the Republic of Phillipines in the Republic of Armenia,"Yerevan, Armenia","The position requires a dedicated and responsible
person to trust on the whole office work. We need a self going,
independent and communicative person."
Loan Officer for Express Operations,FINCA Armenia together with Financial Banking College Foundation,"Yerevan, Armenia","To provide an excellent and rewarding service
experience to the customer service by preparing customers for receiving
loans through making business plan, performing credit training and to
manage the loans provided to the small enterprises."
Receptionist,UniCAD,"Yerevan, Armenia","The Receptionist will be in charge of UniCAD reception
coordination."
Executive Manager,Astra Insurance,"Yerevan, Armenia","Newly established insurance company is seeking for a
professional insurance specialist to head it."
Administrative Assistant,MargaSoft,"Yerevan, Armenia","We need two Administrative Assistants (one for night
shift)."
Armenia Country Director,Institute for War and Peace Reporting,"Yerevan, Armenia","The Institute for War and Peace Reporting is seeking a
new country director for its Yerevan office in Armenia."
Salesperson,Vitesse Ltd.,"Yerevan, Armenia","""Vitesse"" Ltd. seeks a qualified candidate to fill the
position of Salesperson at the tire shop."
Radiotechnology and Electronics Specialist,Henko Ltd.,"Yerevan, Armenia","Repair and maintenance of different electronics,
appliances."
Warehouse Keeper,Intracom S.A. Representation Office in Armenia,"Yerevan, Armenia",N/A
English Language Courses,Career Center NGO,"Yerevan, Armenia
DETAIL DESCRIPTION:  Career Center announces the start of below
mentioned English Language Courses:
- The Main English Course (consisting a total of 3 levels)
1. Beginner
2. Intermediate
3. Advanced
The duration of each level is 3 months.
SPECIAL COURSES:
- Business English - Part I (Basic, Non certificate)
- Business English - Part II (Complete) 
- TOEFL Preparation (Non certificate)
The duration of each course(part) is 2-3 months, depending on the
particular level of a group.
Business English Courses also cover Special Business Writing and
Communication Classes.",NA
Senior Procurement Officer,General Procurement Agency,"Yerevan, Armenia",N/A
Marketing Manager,Cascade Capital Holdings CJSC,"Yerevan, Armenia","Cascade Capital Holdings CJSC is looking for a
motivated, self-driven, highly professional candidate for the position
of Marketing Manager. The incumbent will be responsible for overall
marketing of services and /or products of Cascade Capital Holdings
operational units, continually evaluate the timely adjustment of
marketing strategies and plans, create and develop the marketing
philosophy and policy, and develop and coordinate media coverage, sales
campaigns, and/or promotional materials.
The position will report to the Chief Executive Officer of the Holdings.
We are looking for a well organized and motivated person, able to work in
a western-style office environment towards the achievement of team goals."
Communication Specialist,"International Centre for Advanced Mediterranian Agronomic Studies
(CIHEAM)","Yerevan, Armenia",N/A
Program Coordinator,GIPA,"Tbilisi, Georgia","GIPA-Georgian Rural Development Program is seeking
candidates for the position of Program Coordinator. This is a management
position requiring a wide range of skills and abilities."
Lawyer for Legal Department,"""Inecobank"" CJSC","Yerevan, Armenia",N/A
Programme Management Specialist,UNDP Armenia Country Office,"Yerevan, Armenia","Under the guidance and direct supervision of the
Deputy Resident Representative, the Programme Management Specialist is
responsible for the overall management and coordination of the UNDP
programming activities in the context and with particular focus on its
synergy with the MYFF priorities, Atlas functioning and other corporate
programmatic tools and priorities. The Programme Management Specialist
is responsible for supervising Portfolio Atlas Associates. He/she works
in close collaboration with the National Portfolio Directors and
Implementing Partners, Portfolio Coordinators, Portfolio Atlas
Associates, Operations Team, programme staff in other UN Agencies, UNDP
HQs staff, multi-lateral and bi-lateral donors and civil society."
Funding Manager,Bank of Georgia,"Tbilisi, Georgia","With the help of Senior Management of the Bank of
Georgia, the Funding Manager (FM) will be responsible for attracting and
monitoring credit lines from foreign banking institution including EBRD,
IFC, DEG, etc. The FM will directly report to the Chief Financial
Officer of the Bank."
Office Manager,ACDI/VOCA,"Tbilisi, Georgia","The individual will contribute to the development of a
positive and professional work environment by representing the entire
organization in an appropriate manner. The Office Manager will work very
closely with the all AgVANTAGE departments and other administration staff
members to ensure smooth operation of the AgVANTAGE Activity from an
administrative and logistical standpoint. This position reports directly
to the General Director. The position holder is responsible for managing
the HR Unit, LAN Administrator, Drivers, Receptionist and other support
staff (cleaners, guards, office assistants)."
Sales and Office Manager,Accept Employment Agency,"Yerevan, Armenia","We are looking for a dedicated young personl, ready to
fulfil the position of Sales and Marketing Manager. The incumbent will
work on market development in furnishing and must be ready to travel a
lot."
Sales Assistant in accounting,Accept Employment Agency,"Yerevan, Armenia","We are seeking a career oriented individual, ready to
fulfil the position of Sales Assistant in accounting. The incumbent will
report to the General Accountant."
Pharmacist,Mdecins Sans Frontires-Belgium,"Vardenis, Gegharkunik Marz, RA","The Pharmacist is responsible for MSF pharmacy stock,
ensures provision of drugs for the rural health ambulatories and
policlinics included in the project. The incumbent will work in Vardenis
office of Mdecins Sans Frontires-Belgium (MSF)."
IS Specialist,Coca - Cola Hellenic Bottling Company Armenia,"Yerevan, Armenia",N/A
Atlas Associate,UNDP Armenia Country Office,"Yerevan, Armenia","Under the guidance of the Portfolio Coordinator and
direct supervision of Programme Management Specialist, the Atlas
Associate supports effective delivery of the CO programme in assigned
portfolio by entering and managing data in Atlas and supporting
portfolio programme implementation consistent with UNDP rules and
regulations.
The Atlas Associate works in close collaboration with the Implementing
Partners, Portfolio Coordinators, Specialists, Associates, Operations
Team, programme staff in other UN Agencies, UNDP HQs staff,
multi-lateral and bi-lateral donors and civil society."
Receptionist,Terjan Hotel,"Yerevan, Armenia",N/A
Head Engineer -Mechanic of food (canning) industry,"""Tanger"" Recruitment  Company",Armenia,"A cannery plant is seeking an Engineer- Mechanic for
planning, organizing and technical maintenance of productions."
Manager  (Head) of  food production,"""Tanger"" recruitment  company",Armenia,"A food production manufacturing factory is looking for
a Manager."
Software Developer,CQGI MA,"Yerevan, Armenia",N/A
Accountant,Accept Employment Agency,"Yerevan, Armenia","An international consulting company is looking for a
dedicated and responsible person, ready to fulfil the position of
Accountant to do the accounting and financial consulting of the company."
Support System Administrator,Lycos Europe,"Yerevan, Armenia","Administrating of Linux (Unix) or Windows based
servers."
Auditor,Accept Employment Agency,"Yerevan, Armenia","An international consulting company is looking for a
person, responsible and dedicated to his/her work and the company to do
the auditing of the company."
Specialist for the Development and Marketing Department,"""Inecobank"" CJSC","Yerevan, Armenia",N/A
Project Manager SEO,Lycos Europe,"Yerevan, Armenia","As a Project Coordinator you will be responsible for
tasks such as meeting notes, planning parts of the project,
communication to our development centers in Europe. 
Overall Goal: Increase Search engine generated traffic on Lycos Sites."
Developer Ad Technology,Lycos Europe,"Yerevan, Armenia","To build up our Engineering Team in Armenia, we are
currently looking for motivated technical persons to take over a new
position as a Developer. You will belong to a young and dynamic team
working on the advertising system (named DART Enterprise) and its
existing interfaces. You will work on very different projects like
customisation of the system, building of complex new interfaces, further
development of our reporting tools, technical support to our Sales
departments, etc. During these projects you will also work together with
your colleagues in different European countries."
Senior Customer Care Manager,Lycos Europe,"Yerevan, Armenia","To build up our European Sales Support Team in
Armenia, we are currently looking to recruit a Senior Customer Care
Manager. In this position you will lead our Sales Support Operations
based in Yerevan. This includes responsibility for the professional and
effective management of our European client campaigns and customer
requests as well as personnel leadership for a team of a relevant amount
of people."
Product & Customer Care Manager Free Hosting,Lycos Europe,"Yerevan, Armenia",N/A
Secretary,Armobil Security Services Company,"Yerevan, Armenia",N/A
Java/C++ Backend Developers,Lycos Europe,"Yerevan, Armenia","The role requires dedicated and responsible Java, C++
or PHP professionals. The key elements of the role are full life cycle
product development working in a technically strong team through
requirements gathering, architecture, development and release. The
candidate is required to work closely with the other technical members
of Lycos teams."
Senior Developers,Lycos Europe,"Yerevan, Armenia","The role requires dedicated and responsible Java, C++
or PHP professionals. The key elements of the role are full life cycle
product development working in a technically strong team through
requirements gathering, architecture, development and release. The
candidate is required to work closely with the other technical members
of Lycos teams."
JSP/Java/PHP Developers,Lycos Europe,"Yerevan, Armenia","The role requires dedicated and responsible Java, C++
or PHP professionals. The key elements of the role are full life cycle
product development working in a technically strong team through
requirements gathering, architecture, development and release. The
candidate is required to work closely with the other technical members
of Lycos teams."
Java/C++/PHP Software Developers,Lycos Europe,"Yerevan, Armenia","The role requires dedicated and responsible Java, C++
or PHP professionals. The key elements of the role are full life cycle
product development working in a technically strong team through
requirements gathering, architecture, development and release. The
candidate is required to work closely with the other technical members
of Lycos teams."
C/C++ Software  Developers,Lycos Europe,"Yerevan, Armenia","The role requires dedicated and responsible Java, C++
or PHP professionals. The key elements of the role are full life cycle
product development working in a technically strong team through
requirements gathering, architecture, development and release. The
candidate is required to work closely with the other technical members
of Lycos teams."
PHP Software Developers,Lycos Europe,"Yerevan, Armenia","The role requires dedicated and responsible Java, C++
or PHP professionals. The key elements of the role are full life cycle
product development working in a technically strong team through
requirements gathering, architecture, development and release. The
candidate is required to work closely with the other technical members
of Lycos teams."
Java Software Developers,Lycos Europe,"Yerevan, Armenia","The role requires dedicated and responsible Java, C++
or PHP professionals. The key elements of the role are full life cycle
product development working in a technically strong team through
requirements gathering, architecture, development and release. The
candidate is required to work closely with the other technical members
of Lycos teams."
Monetary Economist,International Monetary Fund,"Tbilisi, Georgia","The International Monetary Fund Office in Georgia is
searching for a Monetary Economist. The position involves working in a
team of four people, headed by the IMF Resident Representative, which
monitors and evaluates economic developments in Georgia. The economist
would be expected to monitor closely developments in the financial
sector, including in the National Bank of Georgia, commercial banks and
financial markets. The position involves daily contact with senior
officials in the National Bank of Georgia, as well as with commercial
bankers and other government departments. The initial appointment will
be for one year, subject to a strong performance during an initial
2-month probationary period."
