Title,Company,Location,JobDescription
Java/C++ Developer for Lycos Mail,Lycos Armenia CJSC,"Yerevan, Armenia","The role requires dedicated Java/C++ professionals
that enjoy using the latest technology in a professional environment of
the Lycos Mail team. The projects concern the exciting Lycos Mail
service at different European locations, like UK (mail.lycos.co.uk),
France (www.caramail.fr), Germany (mail.lycos.de), Sweden
(www.spray.se), with inspiring traffic numbers at 600000 received mails
per hour and more than 5 million active users."
Intern,The Regional Environmental Centre for the Caucasus  REC Caucasus,"Yerevan, Armenia, Tbilisi, Georgia","The Regional Environmental Centre for the Caucasus
Internship Programme offers an opportunity to last year students and
graduates from relevant academics departments from Armenia, Azerbaijan
and Georgia to acquire basic knowledge of environmental issues, office
and project management skills through a two week competitive training
scheme, as well as specific work experience. 
Internship Programme consists of two stage competitive training courses
including:
2 week general capacity building training in Tbilisi. Participants in
the training will undergo a test, and selection will be made from among
the winners to fill the vacancies of interns in the on-the-job training
course at the REC Caucasus office."
Project Coordinator for the Project Gender and Politics,UNDP,"Yerevan, Armenia","The incumbent, under supervision of the UNDP Resident
Representative, will carry out overall coordination of the Project
activities.  In particular s/he will be responsible for:
- Leading, supervising and monitoring overall operational activities and
phases of the Project;
- Liaising with Government entities on consultations related to the
expected commitments;
- Liaising with Donor entities on consultations related to the expected
commitments, in close cooperation with the UNDP Portfolio Manager;
- Liaising with Georgian key stakeholders on both NGO and Governmental
levels;
- Managing financial inputs delivery and ensuring planned outputs as per
Project Document and work plan;
- Updating work plan;
- Ensuring preparation of the project budget revisions, when necessary;
- Monitoring the project budget execution;
- Establishing project administrative structures, ensuring its efficient
operation;
- Reporting to the UNDP on financial and operational status of the
Project;
- Initiating with the local and regional Government counterparts, and in
collaboration with Donors, on building national and regional capacities,
on a successful elaboration of a regional strategy on gender development
and strengthening gender mechanisms nationally and regionally.
- Organizing local and regional seminars;
- Other related duties."
Java/C++ Developer for Lycos Communities,Lycos Europe,"Yerevan, Armenia","The role requires dedicated Java/C++ professionals
that will enjoy applying the latest technologies for solving challenging
tasks in a creative, professional environment of the Lycos Communities
multinational team. Current projects are dedicated to achieving our
ambitious goal of strengthening and expanding our premier position in
Europe and becoming the Number One on-line chat in the World."
JSP/Java Developer for Lycos Chat,Lycos Europe,"Yerevan, Armenia","The role requires dedicated web developer
professionals that will enjoy applying the latest technologies for
solving challenging tasks in a creative, professional environment of the
Lycos Communities multinational team. Current projects are dedicated to
achieving our ambitious goal of strengthening and expanding our premier
position in Europe and becoming the Number One on-line chat in the
World."
Agriculturist,Representation of International Organization,"Yerevan, Armenia","- Dedicated professional in the field of agriculture, ready to fulfil
the position of agriculturist
- Office work, dealing with legal agricultural documents
-Cooperation with Government Agencies
-Provide a professional advise in the field of agriculture
- Interpretation
- Field trips"
Veterinarian,Representation of International Organization,"Yerevan, Armenia","- A dedicated professional, ready to provide and give advise in the
field of veterinary
- Scientific research
- Cooperation with Government Agencies"
Business Analyst,Lycos Europe,"Yerevan, Armenia","Lycos Armenia, a wholly owned subsidiary of Lycos
Europe GmbH, invites MBA students to work on a variety of projects as
part of their summer internship. Typical assignments may include:
- Analysing competitor offerings
- Researching markets for monetization opportunities
- Conducting feasibility studies for new products and services
- Generating ideas for product improvements
- Supporting PR and marketing campaigns"
Software Developer,Zenteq,"Yerevan, Armenia","The position assumes participation in the full
development and deployment cycle of software products and solutions
developed by the company in collaboration with RenderX, Inc."
Free Training Courses,Boomerang Software LLC,"Yerevan, Armenia
DETAIL DESCRIPTION:  Boomerang Software LLC invites young graduates from
American University of Armenia (AUA), Yerevan State University (YSU) and
State Engineering University of Armenia (SEUA), who have studied
Mathematics, Applied Mathematics, Radio Physics and Communication
Systems, Cybernetics, Informatics, Computer Science, etc. as their
majors, as well as all individuals who are interested and proficient in
Information Technologies, to participate in three- to six- months free
training courses depending on the individuals knowledge and progress.
Trainees, who will demonstrate a successful record during the training
courses, will have the opportunity to be employed at Boomerang Software
LLC. Also the knowledge and skills gained through the courses provided
by Boomerang Software LLC will contribute greatly to the trainees
further enrollment in other highly respected firms and companies.",NA
Software Engineer,CIT Ltd,"Yerevan, Armenia","CIT ltd is currently seeking for qualified candidates
for software engineer position to participate in projects."
Chief Accountant,ACRA Credit Bureau,"Yerevan, Armenia","The incumbent will start as the bearer of the main
responsibility of implementing financial, tax and managerial accounting
of the company. As the organization grows and a whole financial
department is formed, he/she will head the department."
Secretary Referent,"""Antares"" Media Holding","Yerevan, Armenia","- Providing secretarial and administrative support to the Director and
his assistants.
- Answering/making telephone calls and faxing messages.
- Maintain the Director's and his assistants' calendar, arranging
meetings, invitations, exhibitions and other appointments.
- Performing other duties as assigned."
Moderator of Electronic Bulletin and Web site,Women's Rights Center,"Yerevan, Armenia","- Collection and editing if the information on violence against women in
Armenia.
- Collection and editing of information of WRC activities."
English Language Teacher,"""Union Lingua"" Educational Center","Yerevan, Armenia",Teaching English in groups and individually
English Language Tutors,"International Registered Nurses of America, Inc.","Yerevan, Armenia","We are looking for volunteers, who are fluent in
written and conversational English, to help Armenian nurses to learn
standard American written and spoken English."
Receptionist/ Admin Assistant,Career Center,"Yerevan, Armenia","The basic purpose of this positin is to ensure smooth
communication and feedback with visitors, donor, partner and other
organizations."
Marketing Manager,Career Center,"Yerevan, Armenia","The incumbent will be primarily involved in
development of marketing plan for current and upcoming projects of the
organization and promote the solid name of the organization in Armenia
and abroad through marketing activities supported by the positions
indicated skills."
Logistics Specialist,"""GTMC"" CJSC","Yerevan, Armenia","We are seeking two candidates for logistics specialist
vacancy  with work experience with CIS countries or Iran."
Training Coordinator /Assistant Project Manager,World Vision Armenia,"Ijevan/Tavush, Armenia","Coordinate all training and capacity building -related
activities in the framework of the project to ensure the project
objectives are met in a timely manner. Work in close cooperation with
the Area Development Program (ADP) Manager."
Agriculture Coordinator,World Vision Armenia,"Ijevan/Tavush, Armenia","Facilitating diversified and market oriented agriculture development
process.
Coordinating and initiating off-farm income generating activities to
ensure the project objectives are met. Work in close cooperation with
Area Development Program (ADP) Manager."
Community Development Coordinator,World Vision Armenia,Ijevan/Tavush Armenia,"To identify strategic issues for community development
within the project framework. To coordinate community development
activities in the site to insure project objectives are met. Work in
close cooperation with Area Development Program (ADP) Manager."
Employment Agency Coordinator,IATC Fund,"Yerevan, Armenia","IATC Fund is seeking an enthusiastic individual for 
IATC Employment Agency Coordinators position. 
Employment Agency Coordinator will also be involved in IATC Fund daily
operations. 2 months probation period is envisaged."
Secretary Referent,"""Veteran"" Travel Services Company","Yerevan, Armenia","We are looking for a qualified Secretary/Referent to
carry out general secretarial and administrative tasks."
Administrative Assistant,MSF Belgium,"Yerevan, Armenia","The incumbent, under supervision of the Mission Administrator, will
carry out administrative activities."
Food & Beverage Supervisor,Armenia Marriott Hotel Yerevan,"Yerevan, Armenia","The restaurant supervisors main function is to
promote and ensure quest satisfaction, achieved through his/her ability
to develop and maintain a strong team environment, placing emphasis on
associate satisfaction and delivery of prompt, courteous, correct
service. The restaurant supervisor is accountable for sales and profit
in his/her area. Prompt and courteous delivery of all room service
orders, maintains positive room service image through all areas of guest
contact and through cleanliness of work areas."
Artist - Designer,"""Antares"" Media Holding","Yerevan, Armenia","- Work directly with the Director of the company on one hand and with
the managing staff on the other hand.
- Deal with the pre-press processes (be familiar  with colour separation
and film output processes).
- Design booklets, posters, book covers, magazines, etc.
- Participate at the exhibitions, different competitions, tenders,
advertising festivals."
Staff Attorney,Armenian Representative office of American Bar Association CEELI Inc.,"Yerevan, Armenia","The American Bar Association, Central European and
Eurasian Law Initiative Criminal Law Program (ABA/CEELI) is seeking a
full time Staff Attorney for the Yerevan office.The successful applicant
will assist the ABA/CEELI liaison and staff in carrying out Criminal Law
Reform programs, including criminal procedure code reform, anti-human
trafficking, defense bar training, and anti-corruption."
Web Developer,Project Harmony ARMENIA,"Yerevan, Armenia","Project Harmony, an innovate, non-profit organization
that builds strong communities by fostering civic leadership, harnessing
internet technology, and facilitating cross-cultural experiential
learning, is currently accepting applications for positions within the
Armenia School Connectivity Programs, a high profile secondary school
technology in education programs of the US Department of State, Bureau
of Educational and Cultural Affairs and the ZANG Armenian Legal
Socialization Project, a unique project that brings together educators
and law enforcement officials to create lessons in legal socialization
that will be piloted in the secondary schools throughout Armenia."
Techincal Writer,Boomerang Software LLC,"Yerevan, Armenia","Boomerang Software LLC is currently seeking for
committed individuals to fill the vacancy of Technical Writer position.
A technical writer is needed to write various documentations relating to
Boomerang Softwares products, including user reference manuals and
online help descriptions. The successful candidates should meet the
following eligibility criteria:"
Online Trainer,Project Harmony Armenian Branch,"Yerevan, Armenia",N/A
Call for papers,Armenian International Policy Research Group (AIPRG),"USA Washington, DC
DETAIL DESCRIPTION:  AIPRG organizes annual conferences and periodic
seminars to promote discussion and debate, and to initiate an overall
policy dialogue covering a wide range of important issues facing Armenia
and the Diaspora. Through such research and conferences, the group works
closely with leading development agencies, international financial
institutions, the donor community, individual researchers, and policy
practitioners to promote a greater understanding of the challenges
facing Armenia and its Diaspora today. 
The third annual conference of the Armenian International Policy
Research Group will be held in January 2005, in Washington, DC. While
the focus of this year conference will be on the issues related to
distribution of income and social safety nets, papers from all areas of
relevance for economic development and growth are welcome. References
should be made to the following broadly-defined sections:
Growth and Poverty Reduction
Social Sector Reforms (Education, Health, and Social Security) 
Taxation and Fiscal Policy
Institutional Reforms and Governance
Banking and Finance
Diaspora Role and Channels of Involvement
Trade, Regional Cooperation, and Geopolitics",NA
Data Managment Analist,ASPO-IT,"Yerevan, Armenia","Must perform data management and data analysis working
with Excel."
Administrative Assistant/Receptionist,The Eurasia Foundation Representative Office in Armenia,"Yerevan, Armenia","The role of Administrative Assistant/Receptionist is
to provide a comprehensive and professional reception service to the
Eurasia Foundation Representative Office in Armenia, including welcoming
visitors, correctly directing all incoming telephone calls, making
occasional translations and providing general administrative support to
the EF/Armenia staff."
Ecologist,Representation of International Organization,"Yerevan, Armenia","- Evaluation of ecosystem or ecobalance of certain productions
- Ensuring the security of those productions"
Tavush Area Development Program (ADP) manager,World Vision Armenia,Ijevan/Tavush Armenia,"Provide leadership and oversight to the design,
development and integration of the WV Armenia civil society and
community-based sectorial initiatives in the area development program
(ADP) in Tavush region"
Sisian Area Development Program (ADP) Site Coordinator,World Vision Armenia,"Sisian/Syunik, Armenia","To coordinate all ADP Community Development activities
in the site to insure project objectives are met. Network with community
groups and project partners to insure civil participation and
development."
Chief Cook,Restaurante,"Yerevan, Armenia","- Prepare food from various cuisines, including European
- Be in charge for kitchen in the Restaurante"
Global Fund Officer (Re-announcement),World Vision Armenia,"Yerevan, Armenia","To work collaboratively with the Program implementing
partners, providing support and coordination to the program operations
monitoring and evaluation."
PHP Trainer,CIT,"Yerevan, Armenia","CIT ltd is currently seeking for qualified candidates
for position of PHP trainer."
Marketing expert,Insurance Agency,"Yerevan, Armenia",N/A
Public Outreach Coordinator,Armenia Tree Project,"Yerevan, Armenia","The Public Outreach Coordinator will work with ATPs
dynamic team to foster environmental revival in Armenia. The position is
Yerevan based, with periodical guest/donor accompanying visits to ATP
sites outside Yerevan. The job is full time."
JSP/Java Developer for Lycos Billing Platform,Lycos Europe,"Yerevan, Armenia","The role requires dedicated web developer
professionals that will enjoy applying the latest technologies in a
creative, professional environment of the Lycos Billing Platform
multinational team. Current projects are dedicated to create unique
billing solution for all premium Lycos Servises."
QA engineer at Lycos Test Center,Lycos Europe,"Yerevan, Armenia","The role requires dedicated and responsible QA
engineers. The test center at Lycos Armenia is responsible for all
testing that is done of our products. The tests that is performed is for
example functional testing, stress testing, load testing, installation
testing, user interface testing etc. The test center is currently
looking for several persons with previous experience in this area."
Project Assistant,Lycos Europe,"Yerevan, Armenia","The role requires dedicated and responsible person. As
a project assistant you will be the key of communication, and make sure
to support the project manager in the whole phase of our projects. The
role requires a person that is self going and communicative."
Java or C++ backend developer for Lycos Communities,Lycos Europe,"Yerevan, Armenia","The role requires dedicated Java/C++ professionals
that will enjoy applying the latest technologies for solving challenging
tasks in a creative, professional environment of the Lycos Communities
multinational team. Current projects are dedicated to achieving our
ambitious goal of strengthening and expanding our premier position in
Europe and becoming the Number One on-line chat in the World."
Software Engineer / Senior Software Engineer,Lycos Europe,"Yerevan, Armenia","In this position, the individual designs, develops,
troubleshoots and debugs software programs. You will be involved into
one of several projects like DataWareHouse, Shopping."
Senior QA engineer at Lycos Test Center,Lycos Europe,"Yerevan, Armenia","The role requires dedicated and responsible person.
Our senior QA engineers takes responsibility for whole projects from
test plan until the testing is completed. The role includes a lot of
communication to our other development centers which are located in
Europe. The test center at Lycos Armenia is responsible for all testing
that is done of our products. The tests that is performed is for example
functional testing, stress testing, load testing, installation testing,
user interface testing etc. The test center is currently looking for
several persons with previous experience in this area."
Advanced Java Developer for Lycos Communities,Lycos Europe,"Yerevan, Armenia","The role requires dedicated Java/C++ professionals
that will enjoy applying the latest technologies for solving challenging
tasks in a creative, professional environment of the Lycos Communities
multinational team. Current projects are dedicated to achieving our
ambitious goal of strengthening and expanding our premier position in
Europe and becoming the Number One on-line chat in the World."
Advanced Java Developer for Lycos Billing Platform,Lycos Europe,"Yerevan, Armenia","The role requires dedicated Java professionals that
will enjoy applying the latest technologies in a creative, professional
environment of the Lycos Billing Platform multinational team. Current
projects are dedicated to create unique billing solution for all premium
Lycos Services."
Office Manager,"LinkGard Systems, LLC.","Yerevan, Armenia","We are seeking applicants for the position of Office
Manager. The job requires highly responsible individuals who will have
responsibility for the daily operations of the entire office."
Staff Accountant,"LinkGard Systems, LLC.","Yerevan, Armenia","Main Accountant for LinkGard Systems, LLC."
IT Specialist - System Admin.,"LinkGard Systems, LLC.","Yerevan, Armenia","The IT Specialist will serve as part of the IT team
responsible for the daily operations of LinkGard client's desktop and
network environment."
Associate Membership,Career Center,"Yerevan, Armenia
NEWS DETAILS:  We're glad to introduce you our Associate membership
offered by Career Center to legal entities. This membership is designed
to maximize the effectiveness of posted announcements in several ways as
described in the membership benefits below.
Membership Benefits include:
1. Complimentary orientation training. Provided to respective
representatives or human resource departments of interested
organizations and institutions on www.careercenter.am website system
usage and advise on effective announcements construction (if
necessary).
2. Personal and Contact Information is filled out One Time. Thereafter
it is filled out automatically in the ""Announcement fill out"" form every
time a new announcement is being filled out.
3. Save Draft announcements before final posting. Enables organizations
to open and edit draft announcements as many times as necessary until
the announcement is finalized and ready to be posted.
4. Modify Submitted & Posted Announcements.
5. Having Logo with all announcements. The logo must be entered only one
time and thereafter it will automatically appear in all announcements.
6. Archive of all Posted or Expired announcements. A listing of all
posted and expired announcements sorted by years and months can be
quickly and easily retrieved.
7. Copy previously posted announcements into new. This benefit saves
your time if a previous announcement includes a lot of information that
must also be included in the new one, so you just make the necessary
modifications for quickly posting the new announcements.
Please follow this link to find out details on specific membership
types: http://www.careercenter.am/membership.htm",NA
Executive Director,Renaissance Insurance Ltd,"Yerevan, Armenia","- To participate in establishment of the company (licensing)
- To manage company's activities."
Web Programmer,Matit Studio,"Yerevan, Armenia","Web Programmer will be responsible for programming web
sites designed and administered by Matit Studio."
Support Engineer,WorldTecGroup LLC,"Yerevan, Armenia","- Manage WorldTecGroup's VoIP Network
- Manage/Prepare client's hardware"
Instructor of Principles of Accounting,Financial Banking College Foundation,"Yerevan, Armenia","The selected instructor will be working with students,
conducting lectures /training sessions in Principles of Accounting for
Banking speciality"
Instructor of Accounting at Enterprises,Financial Banking College Foundation,"Yerevan, Armenia","The selected instructor will be working with students,
conducting lectures /training sessions in Accounting at Enterprises for
Finance speciality"
Instructor of Bank Legislation,Financial Banking College Foundation,"Yerevan, Armenia","The selected instructor will be working with students,
conducting lectures /training sessions in Bank Legislation for Banking
speciality"
Instructor of Analysis of Economic Activities,Financial Banking College Foundation,"Yerevan, Armenia","The selected instructor will be working with students,
conducting lectures /training sessions in Analysis of Economic
Activities for Banking and Finance specialities"
Economic Policy Advisor,Armenian-European Policy and Legal Advice Centre (AEPLAC),"Yerevan, Armenia",Publishing the Armenian Trends quarterly periodical
Executive Director,"Alishan, Ltd.","Masis, Armenia","Overall control, coordination and management of
company operations including production, sales and finance"
Senior Researcher,Economy & Values Research Center,"Yerevan, Armenia","Economy & Values Research Center is seeking a
qualified candidate to work for the Case Studies Development Project as
a Senior Researcher (SR). Under Mr. Manuk Hergnyans guidance, the SR
will help develop Armenian case studies intended for the Harvard
Business School Microeconomics of Competitiveness course delivered at
Yerevan State University. The course has been developed by strategy and
competitiveness guru professor Michael Porter and is currently offered
in 40 universities worldwide with the support of the Harvard Business
School. The work will include research, data analysis and content
development on firm and industry levels. Compensation will be
competitive. Short on-job training will be provided."
Accountant,Education for Sustainable Development Foundation,"Yerevan, Armenia","ESDF currently seeks to fill the position of part-time
Accountant. This position reports directly to the Executive Director."
Health Counsellor,MSF Greece,"Gyumri, Armenia","Counseling on STIs and HIV/ AIDS prevention,
Reproductive health issues through:
- Face to Face counseling
- Hot Line counseling
- Filling the registration forms (Follow up, Face to Face, Hot Line,
Social Reports)"
Business Consultant,3R Strategy LLC,"Yerevan, Armenia","Provide business consultancy in the areas of Business
and Strategic Planning and Analysis, Industry Analysis, Market
Researches, Sub sector Surveys etc."
Grants Associate,The Eurasia Foundation Representative Office in Armenia,"Yerevan, Armenia",N/A
Local Economic Expert,Armenian-European Policy and Legal Advice Centre (AEPLAC),"Yerevan, Armenia","Study of the economic impact of changes in regional
trade pattern on the Armenian economy using Computable General
Equilibrium (CGE) models"
Secretary/Administrative Assistant,ACRA Credit Bureau,"Yerevan, Armenia",Provides administrative assistance to the stuff.
Unix Administrator,ArmenTel JV CJSC,"Yerevan, Armenia",N/A
